16.125,F5,5,M
16.625,F3 A3 C4 F4 F5,5,M
17.625,E3 G3 C4 C5 F5,5,M
18.125,B-4 F5 E3 G3 C4,5,M
18.625,F3 C4 A4 F5,5,M
19.125,E3 G3 G4 F5 F3 C4,5,M
19.625,D3 F4 A3 D4 F5,5,M
20.125,B-3 E4 F5 D3 F4,5,M
20.625,A2 C4 F4 C5 F5,5,M
21.625,B-2 C4 F4 D5 F5,5,M
22.125,C3 B-3 F5 F4 D5,5,M
22.33333333,A3 F5 C3 F4 D5 B-3,5,M
22.375,F5 C3 F4 D5 A3,5,M
22.58333333,F5 C3 F4 D5,5,M
22.625,D3 B-3 F4 D5 F5,5,M
23.125,E3 B-3 F5 F4 D5,5,M
23.625,F3 A3 F4 C5 F5,0,M
24.625,E3 C4 G4 C5 F5,0,M
25.625,F3 C4 A4 D5 F5,0,M
26.625,G3 B3 G4 E5 F5,0,M
27.625,A3 C4 F4,0,M
28.125,B3 D4 G4,0,M
28.625,C4 E4 G4 E5,5,M
29.125,E3 G3 G4 E5,5,M
29.625,F3 A3 F4 D5,5,M
30.125,D3 B3 F4 D5,5,M
30.33333333,C4 D3 F4 D5 B3,5,M
30.375,D3 F4 D5 C4,5,M
30.58333333,D3 F4 D5,5,M
30.625,G3 B3 F4 D5,5,M
31.625,C3 C4 E4 C5,5,M
32.625,F3 C4 F4 A4,5,M
33.625,B-2 F4 D5 B-3,5,M
34.125,A3 B-2 F4 D5,5,M
34.625,C3 G3 E4 C5,5,M
35.625,D3 D4 F4 B-4,5,M
36.125,E3 C4 G4 B-4,5,M
36.625,F3 C4 F4 A4,5,M
37.125,B-2 C4 F4 A4,5,M
37.625,C3 G4 G3 F4,5,M
38.125,A3 C3 G4 F4,5,M
38.625,B-3 E4 C3 G4,5,M
39.125,C4 C3 G4 E4,5,M
39.625,F2 A3 C4 F4,5,M
40.625,F3 A3 C4 F4,5,M
41.625,E3 G3 C4 C5,5,M
42.125,B-4 E3 G3 C4,5,M
42.625,F3 C4 A4,5,M
43.125,E3 G3 G4 F3 C4,5,M
43.625,D3 F4 A3 D4,5,M
44.125,B-3 E4 D3 F4,5,M
44.625,A2 C4 F4 C5,5,M
45.625,B-2 C4 F4 D5,5,M
46.125,C3 B-3 F4 D5,5,M
46.33333333,A3 C3 F4 D5 B-3,5,M
46.375,C3 F4 D5 A3,5,M
46.58333333,C3 F4 D5,5,M
46.625,D3 B-3 F4 D5,5,M
47.125,E3 B-3 F4 D5,5,M
47.625,F3 A3 F4 C5,0,M
48.625,E3 C4 G4 C5,0,M
49.625,F3 C4 A4 D5,0,M
50.625,G3 B3 G4 E5,0,M
51.625,A3 C4 F4 F5,0,M
52.125,B3 D4 G4 F5,0,M
52.625,C4 E4 G4 E5,0,M
53.125,E3 G3 G4 E5,0,M
53.625,F3 A3 F4 D5,0,M
54.125,D3 B3 F4 D5,0,M
54.33333333,C4 D3 F4 D5 B3,5,M
54.375,D3 F4 D5 C4,5,M
54.58333333,D3 F4 D5,5,M
54.625,G3 B3 F4 D5,5,M
55.625,C3 C4 E4 C5,5,M
56.625,F3 C4 F4 A4,5,M
57.625,B-2 F4 D5 B-3,5,M
58.125,A3 B-2 F4 D5,5,M
58.625,C3 G3 E4 C5,5,M
59.625,D3 D4 F4 B-4,5,M
60.125,E3 C4 G4 B-4,5,M
60.625,F3 C4 F4 A4,5,M
61.125,B-2 C4 F4 A4,5,M
61.625,C3 G4 G3 F4,5,M
62.125,A3 C3 G4 F4,5,M
62.625,B-3 E4 C3 G4,5,M
63.125,C4 C3 G4 E4,5,M
63.625,F2 A3 C4 F4,5,M
65.625,E3 C4 G4 C5,5,M
67.625,F3 C4 A4,5,M
68.625,F3 C4,5,M
69.625,E3 C4 G4 C5,5,M
71.625,F3 C4 F4 A4,5,M
73.625,F2 C4 F4 A4,5,M
74.125,G2 C4 F4 A4,5,M
74.625,A2 C4 F4 A4,5,M
75.125,B-2 C4 F4 A4,5,M
75.625,C3 E4 C4 G4,5,M
76.125,D3 D4 C4 G4,5,M
76.625,E3 C4 G4,5,M
77.125,C3 B-3 C4 G4,5,M
77.625,F3 A3 C4 A4,5,M
78.125,G3 B-3 C4 A4,5,M
78.625,A3 C4 A4,5,M
79.125,B-3 D4 A4,5,M
79.625,C4 E4 G4,5,M
80.125,B-3 C4 E4 G4,5,M
80.625,A3 C4 E4 G4,5,M
81.125,G3 C4 E4 G4,5,M
81.625,F3 C4 F4 A4,5,M
82.125,E3 C4 F4 A4,5,M
82.625,D3 D4 F4 A4,5,M
83.125,C3 D4 F4 A4,5,M
83.625,B-2 D4 F4 G4,5,M
84.125,G2 D4 F4 G4,5,M
84.625,C3 E4 C4 G4,5,M
85.125,B-3 C3 E4 G4,5,M
85.625,F2 A3 F4,5,M
86.625,F2 A3,5,M
87.625,D2 D4 A4 F5,5,M
88.125,F2 C4 A4 F5,5,M
88.625,G2 B-3 G4 E5,5,M
89.125,A2 B-3 G4 E5,5,M
89.625,B-2 F4 D5 B-3,5,M
90.125,A3 B-2 F4 D5,5,M
90.625,C3 G3 E4 C5,5,M
91.625,D3 F3 D4 B-4,5,M
92.125,E3 G3 D4 B-4,5,M
92.625,F3 A3 C4 A4,5,M
93.125,A2 A4,5,M
93.625,B-2 B-3 D4 G4,5,M
94.125,G2 B-3 D4 G4,5,M
94.33333333,A3 G2 B-3 D4 G4,5,M
94.375,G2 D4 G4 A3,5,M
94.58333333,G2 D4 G4,5,M
94.625,C3 E4 G3 G4,5,M
95.125,A3 C3 E4 G4,5,M
95.33333333,B-3 C3 E4 A3 G4,?,?
95.375,C3 E4 B-3 G4,?,?
95.58333333,C3 E4 G4,?,?
95.625,F2 A3 C4 F4,?,?
