1,F2,10,M
1.5,B-1,10,M
2.5,F2,10,M
3,B-1,10,M
3.5,F4 F3 B-1,10,M
3.75,F4 F3,10,M
4,F4 F3 F2,10,M
4.5,B-4 D3 B-3 B-1,10,M
4.875,B-1,10,M
5,C5 E-3 C4 B-1,10,M
5.25,C5 E-3 C4,10,M
5.5,D5 F3 D4 F2,10,M
6,B-4 D3 B-3 B-1,10,M
6.375,B-1,10,M
6.5,A4 C3 A3 B-1,10,M
6.75,A4 C3 A3,10,M
7,G4 F2 B-2 G3,10,M
7.5,F4 A2 F3 B-1,10,M
7.875,B-1,10,M
8,G4 B-2 G3 B-1,10,M
8.25,G4 B-2 G3,10,M
8.5,A4 F2 C3 A3,10,M
9,B-4 D3 B-3 B-1,10,M
9.375,B-1,10,M
9.5,C5 E-3 C4 B-1,10,M
9.75,C5 E-3 C4,10,M
10,D5 B-2 F3 D4,10,M
10.5,E-5 G3 E-4 E-2,10,M
11.5,D5 B-2 F3 D4,10,M
12,D5 F3 B-3 D4 B-1,10,M
12.375,F3 B-1,10,M
12.5,E-5 C4 E-4 F3 B-1,10,M
12.75,E-5 F3 C4 E-4,10,M
12.875,F3,10,M
13,F5 D4 F4 F2 F3,10,M
13.25,F5 D4 F4 F2,10,M
13.5,D5 F3 D4 B-1,10,M
13.875,B-1,10,M
14,C5 E-3 C4 B-1,10,M
14.25,C5 E-3 C4,10,M
14.5,B-4 D3 B-3 F2,10,M
15,A4 C3 A3 B-1,10,M
15.375,B-1,10,M
15.5,B-4 D3 B-3 B-1,10,M
15.75,B-4 D3 B-3,10,M
16,C5 E-3 C4 F2,10,M
16.5,D5 F3 D4 B-1,10,M
16.875,B-1,10,M
17,E-5 G3 E-4 B-1,10,M
17.25,E-5 G3 E-4,?,?
17.5,F5 B-2 G#3 F4,?,?
18,G5 B-3 G4 E-2,?,?
19,E-5 E-3 G3 E-4,10,M
19.5,C5 B-3 F2 F3 C4,10,M
19.875,F2 F3 C4,10,M
20,C5 A3 F2 F3 C4,10,M
20.25,C5 A3,10,M
20.5,D5 F2 F3 G#3 D4,10,M
21,E-5 D4 C2 E-3 G3 E-4,10,M
21.375,C2 E-3 G3 E-4,10,M
21.5,E-5 C4 C2 E-3 G3 E-4,10,M
21.75,E-5 C4,10,M
22,E-5 C2 G3 B-3 E-4,10,M
22.5,E-5 F3 E-4 F1 B-3,5,M
22.875,E-5 F3 E-4 F1,5,M
23,E-5 A3 F3 E-4 F1,5,M
23.25,G3,5,M
23.5,E-5 A3 E-4 F4 F2,5,M
24,E-5 E-4 B-1 B-3 F4,5,M
24.375,B-1 B-3 F4,5,M
24.5,D5 D4 B-1 B-3 F4,5,M
24.75,D5 D4,5,M
25,C#5 B-2 B-3 C#4 F4 G4,5,M
25.5,C5 C2 C4 G4 F4,5,M
25.875,C5 C2 C4 G4,5,M
26,C5 E4 C2 C4 G4,5,M
26.25,D4,5,M
26.5,B-4 C3 C4 E4 G4,5,M
27,C4 F4 A4 C2,5,M
27.5,A4 C4 F4 C2,5,M
27.75,A4,5,M
28,C3 C4 G4 C5,5,M
28.5,F5 F4 A4 C2,5,M
28.875,F4 A4 F5 C2,5,M
29,F5 F4 A4 C2,5,M
29.25,F5,5,M
29.5,C3 C4 G4 C5,5,M
30,C4 F4 A4 C2,5,M
31,C4 G4 C3,5,M
31.5,A3 F4 C2,5,M
32.5,C3 G3 C4,5,M
33,F3 A3 C2,5,M
34,C3 G3,5,M
34.5,G5 G4 E-5 C2,7,m
34.875,G5 C2,7,m
35,G5 F4 D5 F5 C2,7,m
35.25,F4 D5 F5,7,m
35.5,E-4 C5 E-5 C3,7,m
36,D4 B4 D5 G2,7,m
36.375,G2,7,m
36.5,E-4 C5 E-5 G2,7,m
36.75,E-4 C5 E-5,7,m
37,G3 F4 D5 F5,7,m
37.5,E-5 E-4 C5 C3,7,m
37.875,E-5 C3,7,m
38,E-5 D4 B-4 D5 C3,7,m
38.25,D4 B-4 D5,7,m
38.5,A4 C5 C3 C4,7,m
39,A3 F#4 A4 D3,7,m
39.375,D3,7,m
39.5,B-3 G4 B-4 D3,7,m
39.75,B-3 G4 B-4,7,m
40,C4 A4 C5 D2,7,m
40.5,D5 D4 B-4 G1,2,m
40.875,D5 G1,2,m
41,D5 C4 A4 C5 G1,2,m
41.25,C4 A4 C5,2,m
41.5,B-3 G4 B-4 G2,2,m
42,A4 A3 F#4 D2,2,m
42.375,A4 D2,2,m
42.5,A4 G3 E4 G4 D2,2,m
42.75,G3 E4 G4,2,m
43,D3 F#3 D4 F#4,2,m
43.5,A5 F3 D4 F4 D2,2,m
43.875,A5 D2,2,m
44,A5 G3 E4 G4 D2,2,m
44.25,G3 E4 G4,2,m
44.5,F5 D3 A3 F4 A4,2,m
45,E5 C#4 A4 C#5 A1,2,m
45.375,A1,2,m
45.5,F5 D4 B4 D5 A1,2,m
45.75,F5 D4 B4 D5,2,m
46,G5 E4 C#5 E5 A2,2,m
46.5,F5 F4 D5 D2 D3,2,m
46.875,F5 D2 D3,2,m
47,F5 E4 G4 C#5 D2 D3,2,m
47.25,E4 G4 C#5,2,m
47.5,F4 A4 D5 F2,2,m
47.875,F2,2,m
48,A4 D5 F5 F3 F2,2,m
48.375,F2 F3,2,m
48.5,E4 G4 C#5 F2 F3,2,m
48.75,E4 G4 C#5 F2,2,m
48.83333333,E4 G4 C#5,2,m
49,F4 A4 D5 F2,2,m
49.5,B-3 F4 B4 C5 F3 C4,10,M
49.875,F3 C4,10,M
50,F4 A4 C5 A3 F3 C4,10,M
50.25,F4 A4 C5 A3,10,M
50.5,F4 G#4 D5 F3 G#3 D4,10,M
51,D4 D5 E-4 G4 E-5 C3 G3,10,M
51.375,E-4 G4 E-5 C3 G3,10,M
51.5,C4 C5 E-4 G4 E-5 C3 G3,10,M
51.75,C4 C5,10,M
52,E-4 F#4 B-4 E-5 C3 F#3 B-3 C4,10,M
52.5,E-5 F4 F3 C4 B-3 B-4,10,M
52.875,F4 E-5 F3 C4,10,M
53,E-5 A3 A4 F4 F3 C4,10,M
53.25,E-5 G4 G3,10,M
53.375,G4 G3,10,M
53.5,A4 E-5 F5 F3 A3 C4 F4,10,M
54,F4 F5 B-2 F3 B-3 B-4 E-5,10,M
54.375,F4 F5 B-2 F3 B-3,10,M
54.5,B-4 D5 F4 F5 B-2 F3 B-3,10,M
54.75,B-4 D5,10,M
55,G4 B-4 C#5 G5 B-2 B-3,10,M
55.5,F5 C3 C4 G4 C5 G5,10,M
55.875,C3 C4 G4 C5 G5,10,M
56,E5 C3 C4 G4 C5 G5,10,M
56.25,D5,5,M
56.5,C3 G4 B-4 E5 G5,5,M
57,A4 C5 F5 A5 C2,5,M
57.5,A4 C5 F5 A5 C2,5,M
57.75,A4,5,M
58,G4 C5 G5 C3,5,M
58.5,F5 F4 A4 C2,5,M
58.875,F4 A4 F5 C2,5,M
59,F5 F4 A4 C2,5,M
59.25,F5,5,M
59.5,C3 C4 G4 C5,5,M
60,C4 E-4 A4 C2,5,M
61,B-3 E-4 G4 C3,10,M
61.5,A3 E-4 F4 C2,10,M
62.5,B-3 E-4 G4 C3,10,M
63,A3 E-4 F4 C2,10,M
64,B-3 E-4 G4 C3,10,M
64.5,E-5 A3 E-4 F4 F1 F2,10,M
65.25,E-5,10,M
65.5,E-5 B-3 E-4 G4 C2 C3,10,M
65.875,E-5,10,M
66,E-5 A3 E-4 F4 F1 F2,10,M
66.375,A3 E-4 F4 F1 F2,10,M
66.5,D5 A3 E-4 F4 F1 F2,10,M
66.75,D5,10,M
67,C5 A3 E-4 G4 F2,10,M
67.5,D5 B-3 D4 F4 B-1,10,M
67.875,B-3 D4 F4 B-1,10,M
68,F5 B-3 D4 F4 B-1,10,M
68.25,F5 B-3 D4 F4,10,M
68.5,F5 F2 B-3 D4 F4,10,M
68.875,F5 B-3 D4 F4,10,M
69,F5 B-1 B-3 D4 F4,10,M
69.75,F5 B-3 D4 F4,10,M
69.83333333,F5,10,M
70,F5 F3 B-3 D4 F2,10,M
70.375,F5 F3 B-3 D4,10,M
70.5,F5 B-1 F3 B-3 D4,10,M
71.25,F5 F3 B-3 D4,10,M
71.33333333,F3 B-3 D4,10,M
71.5,F2 F3 B-3 D4,10,M
71.875,F3 B-3 D4,10,M
72,B-1 F3 B-3 D4,10,M
73,F3 B-3 D4 F2,10,M
73.375,F3 B-3 D4,10,M
73.5,B-1 F3 B-3 D4,10,M
74.25,F3 B-3 D4,?,?
